{
  "schemaVersion": "1.4",
  "summary": {
    "correlationId": "recette-R05",
    "extractorVersion": "0.1.0",
    "revit": {
      "version": "2026",
      "build": null
    },
    "apsEngine": null,
    "source": {
      "fileName": "EGR_Liens.rvt",
      "relativePath": "Projet/EGR_Liens.rvt",
      "isWorkshared": false
    },
    "startedAtUtc": "2026-10-09T12:00:00Z",
    "completedAtUtc": "2026-10-09T12:00:30Z",
    "options": {
      "phaseIds": null,
      "volumeMode": "preserve",
      "sharedParameterKeys": []
    },
    "volumeComputation": {
      "documentComputeVolumes": false,
      "computeApplied": false,
      "transactionRolledBack": null
    },
    "counts": {
      "roomsCollected": 1,
      "roomsExported": 1,
      "roomsWithAnomalies": 0
    },
    "status": "succeededWithWarnings",
    "errors": []
  },
  "rooms": [
    {
      "id_revit": "9000201",
      "unique_id": "EGR18-L01",
      "nom": "Hall",
      "numero": "100",
      "surface_m2": 30.0,
      "hauteur_non_limitee_m": 2.7,
      "niveau": {
        "id_revit": "9000001",
        "unique_id": "EGR18-NIVEAU-R+0",
        "nom": "R+0"
      },
      "occupation": "Accueil",
      "volume_m3": null,
      "statut_volume": "notComputed",
      "finitions": {
        "sol": null,
        "murs": null,
        "plafond": null,
        "plinthe": null
      },
      "phase": {
        "id_revit": "9000012",
        "nom": "Nouvelle construction"
      },
      "variante": null,
      "parametres_partages": {},
      "indicateurs_qualite": []
    }
  ],
  "anomalies": [
    {
      "code": "LINK_MISSING",
      "severity": "warning",
      "scope": "document",
      "elementId": null,
      "message": "Lien Revit absent : EGR_Lien_B.rvt.",
      "details": {
        "linkName": "EGR_Lien_B.rvt",
        "linkPath": "Liens/EGR_Lien_B.rvt"
      }
    },
    {
      "code": "LINK_NOT_LOADED",
      "severity": "info",
      "scope": "document",
      "elementId": null,
      "message": "Lien Revit présent mais non chargé : EGR_Lien_C.rvt.",
      "details": {
        "linkName": "EGR_Lien_C.rvt",
        "linkPath": "Liens/EGR_Lien_C.rvt",
        "linkStatus": "Unloaded"
      }
    },
    {
      "code": "VOLUME_NOT_COMPUTED",
      "severity": "info",
      "scope": "document",
      "elementId": null,
      "message": "Calcul des volumes désactivé dans le document ; volumeM3 exporté à null (mode preserve).",
      "details": {
        "volumeMode": "preserve",
        "roomsAffected": 1
      }
    }
  ]
}
