{
  "schemaVersion": "1.2",
  "summary": {
    "correlationId": "recette-R09",
    "extractorVersion": "0.1.0",
    "revit": {
      "version": "2026",
      "build": null
    },
    "apsEngine": null,
    "source": null,
    "startedAtUtc": "2026-10-09T12:00:00Z",
    "completedAtUtc": "2026-10-09T12:00:30Z",
    "options": {
      "phaseIds": null,
      "volumeMode": "preserve",
      "sharedParameterKeys": []
    },
    "counts": {
      "roomsCollected": 0,
      "roomsExported": 0,
      "roomsWithAnomalies": 0
    },
    "status": "failed",
    "errors": [
      {
        "code": "REVIT_VERSION_INCOMPATIBLE",
        "stage": "document",
        "message": "RVT enregistré avec Revit 2027, postérieur au moteur Revit 2026."
      }
    ]
  },
  "rooms": [],
  "anomalies": []
}
