{
  "schemaVersion": "1.4",
  "summary": {
    "correlationId": "recette-R10",
    "extractorVersion": "0.1.0",
    "revit": {
      "version": "2026",
      "build": null
    },
    "apsEngine": null,
    "source": null,
    "startedAtUtc": "2026-10-09T12:00:00Z",
    "completedAtUtc": "2026-10-09T12:00:30Z",
    "options": {
      "phaseIds": null,
      "volumeMode": "preserve",
      "sharedParameterKeys": []
    },
    "volumeComputation": null,
    "counts": {
      "roomsCollected": 0,
      "roomsExported": 0,
      "roomsWithAnomalies": 0
    },
    "status": "failed",
    "errors": [
      {
        "code": "CONFIG_SCHEMA_UNSUPPORTED",
        "stage": "configuration",
        "message": "settings.json : schemaVersion 2.0 non prise en charge (version majeure 1 attendue)."
      }
    ]
  },
  "rooms": [],
  "anomalies": []
}
